{
  "address": "0x0Ce5B73150D2F5987D5d857FC9C382Bcfb67C5e9",
  "abi": [
    {
      "inputs": [
        {
          "internalType": "uint256",
          "name": "baseRatePerYear",
          "type": "uint256"
        },
        {
          "internalType": "uint256",
          "name": "multiplierPerYear",
          "type": "uint256"
        },
        {
          "internalType": "uint256",
          "name": "jumpMultiplierPerYear",
          "type": "uint256"
        },
        {
          "internalType": "uint256",
          "name": "kink_",
          "type": "uint256"
        }
      ],
      "payable": false,
      "stateMutability": "nonpayable",
      "type": "constructor"
    },
    {
      "anonymous": false,
      "inputs": [
        {
          "indexed": false,
          "internalType": "uint256",
          "name": "baseRatePerBlock",
          "type": "uint256"
        },
        {
          "indexed": false,
          "internalType": "uint256",
          "name": "multiplierPerBlock",
          "type": "uint256"
        },
        {
          "indexed": false,
          "internalType": "uint256",
          "name": "jumpMultiplierPerBlock",
          "type": "uint256"
        },
        {
          "indexed": false,
          "internalType": "uint256",
          "name": "kink",
          "type": "uint256"
        }
      ],
      "name": "NewInterestParams",
      "type": "event"
    },
    {
      "constant": true,
      "inputs": [],
      "name": "baseRatePerBlock",
      "outputs": [
        {
          "internalType": "uint256",
          "name": "",
          "type": "uint256"
        }
      ],
      "payable": false,
      "stateMutability": "view",
      "type": "function"
    },
    {
      "constant": true,
      "inputs": [],
      "name": "blocksPerYear",
      "outputs": [
        {
          "internalType": "uint256",
          "name": "",
          "type": "uint256"
        }
      ],
      "payable": false,
      "stateMutability": "view",
      "type": "function"
    },
    {
      "constant": true,
      "inputs": [
        {
          "internalType": "uint256",
          "name": "cash",
          "type": "uint256"
        },
        {
          "internalType": "uint256",
          "name": "borrows",
          "type": "uint256"
        },
        {
          "internalType": "uint256",
          "name": "reserves",
          "type": "uint256"
        }
      ],
      "name": "getBorrowRate",
      "outputs": [
        {
          "internalType": "uint256",
          "name": "",
          "type": "uint256"
        }
      ],
      "payable": false,
      "stateMutability": "view",
      "type": "function"
    },
    {
      "constant": true,
      "inputs": [
        {
          "internalType": "uint256",
          "name": "cash",
          "type": "uint256"
        },
        {
          "internalType": "uint256",
          "name": "borrows",
          "type": "uint256"
        },
        {
          "internalType": "uint256",
          "name": "reserves",
          "type": "uint256"
        },
        {
          "internalType": "uint256",
          "name": "reserveFactorMantissa",
          "type": "uint256"
        }
      ],
      "name": "getSupplyRate",
      "outputs": [
        {
          "internalType": "uint256",
          "name": "",
          "type": "uint256"
        }
      ],
      "payable": false,
      "stateMutability": "view",
      "type": "function"
    },
    {
      "constant": true,
      "inputs": [],
      "name": "isInterestRateModel",
      "outputs": [
        {
          "internalType": "bool",
          "name": "",
          "type": "bool"
        }
      ],
      "payable": false,
      "stateMutability": "view",
      "type": "function"
    },
    {
      "constant": true,
      "inputs": [],
      "name": "jumpMultiplierPerBlock",
      "outputs": [
        {
          "internalType": "uint256",
          "name": "",
          "type": "uint256"
        }
      ],
      "payable": false,
      "stateMutability": "view",
      "type": "function"
    },
    {
      "constant": true,
      "inputs": [],
      "name": "kink",
      "outputs": [
        {
          "internalType": "uint256",
          "name": "",
          "type": "uint256"
        }
      ],
      "payable": false,
      "stateMutability": "view",
      "type": "function"
    },
    {
      "constant": true,
      "inputs": [],
      "name": "multiplierPerBlock",
      "outputs": [
        {
          "internalType": "uint256",
          "name": "",
          "type": "uint256"
        }
      ],
      "payable": false,
      "stateMutability": "view",
      "type": "function"
    },
    {
      "constant": true,
      "inputs": [],
      "name": "owner",
      "outputs": [
        {
          "internalType": "address",
          "name": "",
          "type": "address"
        }
      ],
      "payable": false,
      "stateMutability": "view",
      "type": "function"
    },
    {
      "constant": false,
      "inputs": [
        {
          "internalType": "address",
          "name": "_newOwner",
          "type": "address"
        }
      ],
      "name": "setAdmin",
      "outputs": [],
      "payable": false,
      "stateMutability": "nonpayable",
      "type": "function"
    },
    {
      "constant": false,
      "inputs": [
        {
          "internalType": "uint256",
          "name": "baseRatePerYear",
          "type": "uint256"
        },
        {
          "internalType": "uint256",
          "name": "multiplierPerYear",
          "type": "uint256"
        },
        {
          "internalType": "uint256",
          "name": "jumpMultiplierPerYear",
          "type": "uint256"
        },
        {
          "internalType": "uint256",
          "name": "kink_",
          "type": "uint256"
        }
      ],
      "name": "updateJumpRateModel",
      "outputs": [],
      "payable": false,
      "stateMutability": "nonpayable",
      "type": "function"
    },
    {
      "constant": true,
      "inputs": [
        {
          "internalType": "uint256",
          "name": "cash",
          "type": "uint256"
        },
        {
          "internalType": "uint256",
          "name": "borrows",
          "type": "uint256"
        },
        {
          "internalType": "uint256",
          "name": "reserves",
          "type": "uint256"
        }
      ],
      "name": "utilizationRate",
      "outputs": [
        {
          "internalType": "uint256",
          "name": "",
          "type": "uint256"
        }
      ],
      "payable": false,
      "stateMutability": "pure",
      "type": "function"
    }
  ],
  "transactionHash": "0x4481eff3a734425f7541e24bff5c35cd9eb2264b28bc928e6a272a319f221b57",
  "receipt": {
    "to": null,
    "from": "0x380D28B50e336DDE7750eB4Fe7b735E19B180640",
    "contractAddress": "0x0Ce5B73150D2F5987D5d857FC9C382Bcfb67C5e9",
    "transactionIndex": 133,
    "gasUsed": "604968",
    "logsBloom": "0x00000000000000000000200000000000000000000000000000000000000000000000000000000000000000000000000000000000000000000000000000000000000000000000000000000000000000000000000000000000000000000000000000000000000000000000000000000000000000000000000000000000000000000000000000000000000000000000000000000000000000000000000000000000000000000004000000000000000000000000088000000000000000000000000000000000000000000000100000000000040000000000000000000000000000000000000000000000000000000000000000000000000000000000000000000000",
    "blockHash": "0x57a938556107fe64c7506c879927100399a74752be7fc3b61d8594bcf19c5779",
    "transactionHash": "0x4481eff3a734425f7541e24bff5c35cd9eb2264b28bc928e6a272a319f221b57",
    "logs": [
      {
        "transactionIndex": 133,
        "blockNumber": 16673613,
        "transactionHash": "0x4481eff3a734425f7541e24bff5c35cd9eb2264b28bc928e6a272a319f221b57",
        "address": "0x0Ce5B73150D2F5987D5d857FC9C382Bcfb67C5e9",
        "topics": [
          "0x6960ab234c7ef4b0c9197100f5393cfcde7c453ac910a27bd2000aa1dd4c068d"
        ],
        "data": "0x000000000000000000000000000000000000000000000000000000000000000000000000000000000000000000000000000000000000000000000006ebec367f00000000000000000000000000000000000000000000000000000078b654fe360000000000000000000000000000000000000000000000000b1a2bc2ec500000",
        "logIndex": 347,
        "blockHash": "0x57a938556107fe64c7506c879927100399a74752be7fc3b61d8594bcf19c5779"
      }
    ],
    "blockNumber": 16673613,
    "cumulativeGasUsed": "14730672",
    "status": 1,
    "byzantium": true
  },
  "args": [
    "0",
    "49999999998268800",
    "1089999999998841600",
    "800000000000000000"
  ],
  "numDeployments": 1,
  "solcInputHash": "bc025e7bce9ee8dee5f68883a99283cb",
  "metadata": "{\"compiler\":{\"version\":\"0.5.16+commit.9c3226ce\"},\"language\":\"Solidity\",\"output\":{\"abi\":[{\"inputs\":[{\"internalType\":\"uint256\",\"name\":\"baseRatePerYear\",\"type\":\"uint256\"},{\"internalType\":\"uint256\",\"name\":\"multiplierPerYear\",\"type\":\"uint256\"},{\"internalType\":\"uint256\",\"name\":\"jumpMultiplierPerYear\",\"type\":\"uint256\"},{\"internalType\":\"uint256\",\"name\":\"kink_\",\"type\":\"uint256\"}],\"payable\":false,\"stateMutability\":\"nonpayable\",\"type\":\"constructor\"},{\"anonymous\":false,\"inputs\":[{\"indexed\":false,\"internalType\":\"uint256\",\"name\":\"baseRatePerBlock\",\"type\":\"uint256\"},{\"indexed\":false,\"internalType\":\"uint256\",\"name\":\"multiplierPerBlock\",\"type\":\"uint256\"},{\"indexed\":false,\"internalType\":\"uint256\",\"name\":\"jumpMultiplierPerBlock\",\"type\":\"uint256\"},{\"indexed\":false,\"internalType\":\"uint256\",\"name\":\"kink\",\"type\":\"uint256\"}],\"name\":\"NewInterestParams\",\"type\":\"event\"},{\"constant\":true,\"inputs\":[],\"name\":\"baseRatePerBlock\",\"outputs\":[{\"internalType\":\"uint256\",\"name\":\"\",\"type\":\"uint256\"}],\"payable\":false,\"stateMutability\":\"view\",\"type\":\"function\"},{\"constant\":true,\"inputs\":[],\"name\":\"blocksPerYear\",\"outputs\":[{\"internalType\":\"uint256\",\"name\":\"\",\"type\":\"uint256\"}],\"payable\":false,\"stateMutability\":\"view\",\"type\":\"function\"},{\"constant\":true,\"inputs\":[{\"internalType\":\"uint256\",\"name\":\"cash\",\"type\":\"uint256\"},{\"internalType\":\"uint256\",\"name\":\"borrows\",\"type\":\"uint256\"},{\"internalType\":\"uint256\",\"name\":\"reserves\",\"type\":\"uint256\"}],\"name\":\"getBorrowRate\",\"outputs\":[{\"internalType\":\"uint256\",\"name\":\"\",\"type\":\"uint256\"}],\"payable\":false,\"stateMutability\":\"view\",\"type\":\"function\"},{\"constant\":true,\"inputs\":[{\"internalType\":\"uint256\",\"name\":\"cash\",\"type\":\"uint256\"},{\"internalType\":\"uint256\",\"name\":\"borrows\",\"type\":\"uint256\"},{\"internalType\":\"uint256\",\"name\":\"reserves\",\"type\":\"uint256\"},{\"internalType\":\"uint256\",\"name\":\"reserveFactorMantissa\",\"type\":\"uint256\"}],\"name\":\"getSupplyRate\",\"outputs\":[{\"internalType\":\"uint256\",\"name\":\"\",\"type\":\"uint256\"}],\"payable\":false,\"stateMutability\":\"view\",\"type\":\"function\"},{\"constant\":true,\"inputs\":[],\"name\":\"isInterestRateModel\",\"outputs\":[{\"internalType\":\"bool\",\"name\":\"\",\"type\":\"bool\"}],\"payable\":false,\"stateMutability\":\"view\",\"type\":\"function\"},{\"constant\":true,\"inputs\":[],\"name\":\"jumpMultiplierPerBlock\",\"outputs\":[{\"internalType\":\"uint256\",\"name\":\"\",\"type\":\"uint256\"}],\"payable\":false,\"stateMutability\":\"view\",\"type\":\"function\"},{\"constant\":true,\"inputs\":[],\"name\":\"kink\",\"outputs\":[{\"internalType\":\"uint256\",\"name\":\"\",\"type\":\"uint256\"}],\"payable\":false,\"stateMutability\":\"view\",\"type\":\"function\"},{\"constant\":true,\"inputs\":[],\"name\":\"multiplierPerBlock\",\"outputs\":[{\"internalType\":\"uint256\",\"name\":\"\",\"type\":\"uint256\"}],\"payable\":false,\"stateMutability\":\"view\",\"type\":\"function\"},{\"constant\":true,\"inputs\":[],\"name\":\"owner\",\"outputs\":[{\"internalType\":\"address\",\"name\":\"\",\"type\":\"address\"}],\"payable\":false,\"stateMutability\":\"view\",\"type\":\"function\"},{\"constant\":false,\"inputs\":[{\"internalType\":\"address\",\"name\":\"_newOwner\",\"type\":\"address\"}],\"name\":\"setAdmin\",\"outputs\":[],\"payable\":false,\"stateMutability\":\"nonpayable\",\"type\":\"function\"},{\"constant\":false,\"inputs\":[{\"internalType\":\"uint256\",\"name\":\"baseRatePerYear\",\"type\":\"uint256\"},{\"internalType\":\"uint256\",\"name\":\"multiplierPerYear\",\"type\":\"uint256\"},{\"internalType\":\"uint256\",\"name\":\"jumpMultiplierPerYear\",\"type\":\"uint256\"},{\"internalType\":\"uint256\",\"name\":\"kink_\",\"type\":\"uint256\"}],\"name\":\"updateJumpRateModel\",\"outputs\":[],\"payable\":false,\"stateMutability\":\"nonpayable\",\"type\":\"function\"},{\"constant\":true,\"inputs\":[{\"internalType\":\"uint256\",\"name\":\"cash\",\"type\":\"uint256\"},{\"internalType\":\"uint256\",\"name\":\"borrows\",\"type\":\"uint256\"},{\"internalType\":\"uint256\",\"name\":\"reserves\",\"type\":\"uint256\"}],\"name\":\"utilizationRate\",\"outputs\":[{\"internalType\":\"uint256\",\"name\":\"\",\"type\":\"uint256\"}],\"payable\":false,\"stateMutability\":\"pure\",\"type\":\"function\"}],\"devdoc\":{\"author\":\"Arr00\",\"methods\":{\"getBorrowRate(uint256,uint256,uint256)\":{\"params\":{\"borrows\":\"The amount of borrows in the market\",\"cash\":\"The amount of cash in the market\",\"reserves\":\"The amount of reserves in the market\"},\"return\":\"The borrow rate percentage per block as a mantissa (scaled by 1e18)\"},\"getSupplyRate(uint256,uint256,uint256,uint256)\":{\"params\":{\"borrows\":\"The amount of borrows in the market\",\"cash\":\"The amount of cash in the market\",\"reserveFactorMantissa\":\"The current reserve factor for the market\",\"reserves\":\"The amount of reserves in the market\"},\"return\":\"The supply rate percentage per block as a mantissa (scaled by 1e18)\"},\"setAdmin(address)\":{\"params\":{\"_newOwner\":\"The new owner address\"}},\"updateJumpRateModel(uint256,uint256,uint256,uint256)\":{\"params\":{\"baseRatePerYear\":\"The approximate target base APR, as a mantissa (scaled by 1e18)\",\"jumpMultiplierPerYear\":\"The multiplierPerBlock after hitting a specified utilization point\",\"kink_\":\"The utilization point at which the jump multiplier is applied\",\"multiplierPerYear\":\"The rate of increase in interest rate wrt utilization (scaled by 1e18)\"}},\"utilizationRate(uint256,uint256,uint256)\":{\"params\":{\"borrows\":\"The amount of borrows in the market\",\"cash\":\"The amount of cash in the market\",\"reserves\":\"The amount of reserves in the market (currently unused)\"},\"return\":\"The utilization rate as a mantissa between [0, 1e18]\"}},\"title\":\"Compound's JumpRateModel Contract V2 for V2 cTokens\"},\"userdoc\":{\"methods\":{\"getBorrowRate(uint256,uint256,uint256)\":{\"notice\":\"Calculates the current borrow rate per block\"},\"getSupplyRate(uint256,uint256,uint256,uint256)\":{\"notice\":\"Calculates the current supply rate per block\"},\"setAdmin(address)\":{\"notice\":\"external function to transfer owner role\"},\"updateJumpRateModel(uint256,uint256,uint256,uint256)\":{\"notice\":\"Update the parameters of the interest rate model (only callable by owner, i.e. Timelock)\"},\"utilizationRate(uint256,uint256,uint256)\":{\"notice\":\"Calculates the utilization rate of the market: `borrows / (cash + borrows - reserves)`\"}},\"notice\":\"Supports only for V2 cTokens\"}},\"settings\":{\"compilationTarget\":{\"contracts/InterestRateModels/JumpRateModelV2.sol\":\"JumpRateModelV2\"},\"evmVersion\":\"istanbul\",\"libraries\":{},\"metadata\":{\"useLiteralContent\":true},\"optimizer\":{\"enabled\":true,\"runs\":200},\"remappings\":[]},\"sources\":{\"contracts/InterestRateModels/InterestRateModel.sol\":{\"content\":\"import \\\"../markets/SafeMath.sol\\\";\\n\\npragma solidity ^0.5.16;\\n\\n/**\\n  * @title Compound's InterestRateModel Interface\\n  * @author Compound\\n  */\\ncontract InterestRateModel {\\n    /// @notice Indicator that this is an InterestRateModel contract (for inspection)\\n    bool public constant isInterestRateModel = true;\\n\\n    /**\\n      * @notice Calculates the current borrow interest rate per block\\n      * @param cash The total amount of cash the market has\\n      * @param borrows The total amount of borrows the market has outstanding\\n      * @param reserves The total amount of reserves the market has\\n      * @return The borrow rate per block (as a percentage, and scaled by 1e18)\\n      */\\n    function getBorrowRate(uint cash, uint borrows, uint reserves) external view returns (uint);\\n\\n    /**\\n      * @notice Calculates the current supply interest rate per block\\n      * @param cash The total amount of cash the market has\\n      * @param borrows The total amount of borrows the market has outstanding\\n      * @param reserves The total amount of reserves the market has\\n      * @param reserveFactorMantissa The current reserve factor the market has\\n      * @return The supply rate per block (as a percentage, and scaled by 1e18)\\n      */\\n    function getSupplyRate(uint cash, uint borrows, uint reserves, uint reserveFactorMantissa) external view returns (uint);\\n\\n}\\n\",\"keccak256\":\"0x5c63b9fd7c4ea5a1e3a5382e160dc271b146deadacfd5ffd7b161ef741d252b9\"},\"contracts/InterestRateModels/JumpRateModelV2.sol\":{\"content\":\"import \\\"./InterestRateModel.sol\\\";\\n\\npragma solidity ^0.5.16;\\n\\n/**\\n  * @title Logic for Compound's JumpRateModel Contract V2.\\n  * @author Compound (modified by Dharma Labs, refactored by Arr00)\\n  * @notice Version 2 modifies Version 1 by enabling updateable parameters.\\n  */\\ncontract BaseJumpRateModelV2 {\\n    using SafeMath for uint;\\n\\n    event NewInterestParams(uint baseRatePerBlock, uint multiplierPerBlock, uint jumpMultiplierPerBlock, uint kink);\\n\\n    /**\\n     * @notice The address of the owner, i.e. the Timelock contract, which can update parameters directly\\n     */\\n    address public owner;\\n\\n    /**\\n     * @notice The approximate number of blocks per year that is assumed by the interest rate model\\n     */\\n    uint public constant blocksPerYear = 2102400;\\n\\n    /**\\n     * @notice The multiplier of utilization rate that gives the slope of the interest rate\\n     */\\n    uint public multiplierPerBlock;\\n\\n    /**\\n     * @notice The base interest rate which is the y-intercept when utilization rate is 0\\n     */\\n    uint public baseRatePerBlock;\\n\\n    /**\\n     * @notice The multiplierPerBlock after hitting a specified utilization point\\n     */\\n    uint public jumpMultiplierPerBlock;\\n\\n    /**\\n     * @notice The utilization point at which the jump multiplier is applied\\n     */\\n    uint public kink;\\n\\n    /**\\n     * @notice Construct an interest rate model\\n     * @param baseRatePerYear The approximate target base APR, as a mantissa (scaled by 1e18)\\n     * @param multiplierPerYear The rate of increase in interest rate wrt utilization (scaled by 1e18)\\n     * @param jumpMultiplierPerYear The multiplierPerBlock after hitting a specified utilization point\\n     * @param kink_ The utilization point at which the jump multiplier is applied\\n     */\\n    constructor(uint baseRatePerYear, uint multiplierPerYear, uint jumpMultiplierPerYear, uint kink_) internal {\\n        owner = tx.origin;\\n\\n        updateJumpRateModelInternal(baseRatePerYear,  multiplierPerYear, jumpMultiplierPerYear, kink_);\\n    }\\n\\n    /**\\n     * @notice Update the parameters of the interest rate model (only callable by owner, i.e. Timelock)\\n     * @param baseRatePerYear The approximate target base APR, as a mantissa (scaled by 1e18)\\n     * @param multiplierPerYear The rate of increase in interest rate wrt utilization (scaled by 1e18)\\n     * @param jumpMultiplierPerYear The multiplierPerBlock after hitting a specified utilization point\\n     * @param kink_ The utilization point at which the jump multiplier is applied\\n     */\\n    function updateJumpRateModel(uint baseRatePerYear, uint multiplierPerYear, uint jumpMultiplierPerYear, uint kink_) external {\\n        require(msg.sender == owner, \\\"only the owner may call this function.\\\");\\n\\n        updateJumpRateModelInternal(baseRatePerYear, multiplierPerYear, jumpMultiplierPerYear, kink_);\\n    }\\n\\n    /**\\n     * @notice Calculates the utilization rate of the market: `borrows / (cash + borrows - reserves)`\\n     * @param cash The amount of cash in the market\\n     * @param borrows The amount of borrows in the market\\n     * @param reserves The amount of reserves in the market (currently unused)\\n     * @return The utilization rate as a mantissa between [0, 1e18]\\n     */\\n    function utilizationRate(uint cash, uint borrows, uint reserves) public pure returns (uint) {\\n        // Utilization rate is 0 when there are no borrows\\n        if (borrows == 0) {\\n            return 0;\\n        }\\n\\n        return borrows.mul(1e18).div(cash.add(borrows).sub(reserves));\\n    }\\n\\n    /**\\n     * @notice Calculates the current borrow rate per block, with the error code expected by the market\\n     * @param cash The amount of cash in the market\\n     * @param borrows The amount of borrows in the market\\n     * @param reserves The amount of reserves in the market\\n     * @return The borrow rate percentage per block as a mantissa (scaled by 1e18)\\n     */\\n    function getBorrowRateInternal(uint cash, uint borrows, uint reserves) internal view returns (uint) {\\n        uint util = utilizationRate(cash, borrows, reserves);\\n\\n        if (util <= kink) {\\n            return util.mul(multiplierPerBlock).div(1e18).add(baseRatePerBlock);\\n        } else {\\n            uint normalRate = kink.mul(multiplierPerBlock).div(1e18).add(baseRatePerBlock);\\n            uint excessUtil = util.sub(kink);\\n            return excessUtil.mul(jumpMultiplierPerBlock).div(1e18).add(normalRate);\\n        }\\n    }\\n\\n    /**\\n     * @notice Calculates the current supply rate per block\\n     * @param cash The amount of cash in the market\\n     * @param borrows The amount of borrows in the market\\n     * @param reserves The amount of reserves in the market\\n     * @param reserveFactorMantissa The current reserve factor for the market\\n     * @return The supply rate percentage per block as a mantissa (scaled by 1e18)\\n     */\\n    function getSupplyRate(uint cash, uint borrows, uint reserves, uint reserveFactorMantissa) public view returns (uint) {\\n        uint oneMinusReserveFactor = uint(1e18).sub(reserveFactorMantissa);\\n        uint borrowRate = getBorrowRateInternal(cash, borrows, reserves);\\n        uint rateToPool = borrowRate.mul(oneMinusReserveFactor).div(1e18);\\n        return utilizationRate(cash, borrows, reserves).mul(rateToPool).div(1e18);\\n    }\\n\\n    /**\\n     * @notice Internal function to update the parameters of the interest rate model\\n     * @param baseRatePerYear The approximate target base APR, as a mantissa (scaled by 1e18)\\n     * @param multiplierPerYear The rate of increase in interest rate wrt utilization (scaled by 1e18)\\n     * @param jumpMultiplierPerYear The multiplierPerBlock after hitting a specified utilization point\\n     * @param kink_ The utilization point at which the jump multiplier is applied\\n     */\\n    function updateJumpRateModelInternal(uint baseRatePerYear, uint multiplierPerYear, uint jumpMultiplierPerYear, uint kink_) internal {\\n        baseRatePerBlock = baseRatePerYear.div(blocksPerYear);\\n        multiplierPerBlock = (multiplierPerYear.mul(1e18)).div(blocksPerYear.mul(kink_));\\n        jumpMultiplierPerBlock = jumpMultiplierPerYear.div(blocksPerYear);\\n        kink = kink_;\\n\\n        emit NewInterestParams(baseRatePerBlock, multiplierPerBlock, jumpMultiplierPerBlock, kink);\\n    }\\n\\n    /**\\n     * @notice external function to transfer owner role\\n     * @param _newOwner The new owner address\\n     */\\n    function setAdmin(address _newOwner) external {\\n        require(msg.sender == owner, \\\"only the owner may call this function.\\\");\\n        owner = _newOwner;\\n    }\\n}\\n\\n/**\\n  * @title Compound's JumpRateModel Contract V2 for V2 cTokens\\n  * @author Arr00\\n  * @notice Supports only for V2 cTokens\\n  */\\ncontract JumpRateModelV2 is InterestRateModel, BaseJumpRateModelV2  {\\n\\n\\t/**\\n     * @notice Calculates the current borrow rate per block\\n     * @param cash The amount of cash in the market\\n     * @param borrows The amount of borrows in the market\\n     * @param reserves The amount of reserves in the market\\n     * @return The borrow rate percentage per block as a mantissa (scaled by 1e18)\\n     */\\n    function getBorrowRate(uint cash, uint borrows, uint reserves) external view returns (uint) {\\n        return getBorrowRateInternal(cash, borrows, reserves);\\n    }\\n\\n    constructor(uint baseRatePerYear, uint multiplierPerYear, uint jumpMultiplierPerYear, uint kink_) \\n    \\tBaseJumpRateModelV2(baseRatePerYear,multiplierPerYear,jumpMultiplierPerYear,kink_) public {}\\n}\\n\",\"keccak256\":\"0x46ab4e54c447cdb3ef9e9c9877676e6d10a05dd47123d53c581eecaa20ef7142\"},\"contracts/markets/SafeMath.sol\":{\"content\":\"// From https://github.com/OpenZeppelin/openzeppelin-contracts/blob/master/contracts/math/Math.sol\\n// Subject to the MIT license.\\n\\npragma solidity ^0.5.16;\\n\\nlibrary SafeMath {\\n    /**\\n     * @dev Returns the addition of two unsigned integers, reverting on overflow.\\n     *\\n     * Counterpart to Solidity's `+` operator.\\n     *\\n     * Requirements:\\n     * - Addition cannot overflow.\\n     */\\n    function add(uint256 a, uint256 b) internal pure returns (uint256) {\\n        uint256 c = a + b;\\n        require(c >= a, \\\"SafeMath: addition overflow\\\");\\n\\n        return c;\\n    }\\n\\n    /**\\n     * @dev Returns the addition of two unsigned integers, reverting with custom message on overflow.\\n     *\\n     * Counterpart to Solidity's `+` operator.\\n     *\\n     * Requirements:\\n     * - Addition cannot overflow.\\n     */\\n    function add(uint256 a, uint256 b, string memory errorMessage) internal pure returns (uint256) {\\n        uint256 c = a + b;\\n        require(c >= a, errorMessage);\\n\\n        return c;\\n    }\\n\\n    /**\\n     * @dev Returns the subtraction of two unsigned integers, reverting on underflow (when the result is negative).\\n     *\\n     * Counterpart to Solidity's `-` operator.\\n     *\\n     * Requirements:\\n     * - Subtraction cannot underflow.\\n     */\\n    function sub(uint256 a, uint256 b) internal pure returns (uint256) {\\n        return sub(a, b, \\\"SafeMath: subtraction underflow\\\");\\n    }\\n\\n    /**\\n     * @dev Returns the subtraction of two unsigned integers, reverting with custom message on underflow (when the result is negative).\\n     *\\n     * Counterpart to Solidity's `-` operator.\\n     *\\n     * Requirements:\\n     * - Subtraction cannot underflow.\\n     */\\n    function sub(uint256 a, uint256 b, string memory errorMessage) internal pure returns (uint256) {\\n        require(b <= a, errorMessage);\\n        uint256 c = a - b;\\n\\n        return c;\\n    }\\n\\n    /**\\n     * @dev Returns the multiplication of two unsigned integers, reverting on overflow.\\n     *\\n     * Counterpart to Solidity's `*` operator.\\n     *\\n     * Requirements:\\n     * - Multiplication cannot overflow.\\n     */\\n    function mul(uint256 a, uint256 b) internal pure returns (uint256) {\\n        // Gas optimization: this is cheaper than requiring 'a' not being zero, but the\\n        // benefit is lost if 'b' is also tested.\\n        // See: https://github.com/OpenZeppelin/openzeppelin-contracts/pull/522\\n        if (a == 0) {\\n            return 0;\\n        }\\n\\n        uint256 c = a * b;\\n        require(c / a == b, \\\"SafeMath: multiplication overflow\\\");\\n\\n        return c;\\n    }\\n\\n    /**\\n     * @dev Returns the multiplication of two unsigned integers, reverting on overflow.\\n     *\\n     * Counterpart to Solidity's `*` operator.\\n     *\\n     * Requirements:\\n     * - Multiplication cannot overflow.\\n     */\\n    function mul(uint256 a, uint256 b, string memory errorMessage) internal pure returns (uint256) {\\n        // Gas optimization: this is cheaper than requiring 'a' not being zero, but the\\n        // benefit is lost if 'b' is also tested.\\n        // See: https://github.com/OpenZeppelin/openzeppelin-contracts/pull/522\\n        if (a == 0) {\\n            return 0;\\n        }\\n\\n        uint256 c = a * b;\\n        require(c / a == b, errorMessage);\\n\\n        return c;\\n    }\\n\\n    /**\\n     * @dev Returns the integer division of two unsigned integers.\\n     * Reverts on division by zero. The result is rounded towards zero.\\n     *\\n     * Counterpart to Solidity's `/` operator. Note: this function uses a\\n     * `revert` opcode (which leaves remaining gas untouched) while Solidity\\n     * uses an invalid opcode to revert (consuming all remaining gas).\\n     *\\n     * Requirements:\\n     * - The divisor cannot be zero.\\n     */\\n    function div(uint256 a, uint256 b) internal pure returns (uint256) {\\n        return div(a, b, \\\"SafeMath: division by zero\\\");\\n    }\\n\\n    /**\\n     * @dev Returns the integer division of two unsigned integers.\\n     * Reverts with custom message on division by zero. The result is rounded towards zero.\\n     *\\n     * Counterpart to Solidity's `/` operator. Note: this function uses a\\n     * `revert` opcode (which leaves remaining gas untouched) while Solidity\\n     * uses an invalid opcode to revert (consuming all remaining gas).\\n     *\\n     * Requirements:\\n     * - The divisor cannot be zero.\\n     */\\n    function div(uint256 a, uint256 b, string memory errorMessage) internal pure returns (uint256) {\\n        // Solidity only automatically asserts when dividing by 0\\n        require(b > 0, errorMessage);\\n        uint256 c = a / b;\\n        // assert(a == b * c + a % b); // There is no case in which this doesn't hold\\n\\n        return c;\\n    }\\n\\n    /**\\n     * @dev Returns the remainder of dividing two unsigned integers. (unsigned integer modulo),\\n     * Reverts when dividing by zero.\\n     *\\n     * Counterpart to Solidity's `%` operator. This function uses a `revert`\\n     * opcode (which leaves remaining gas untouched) while Solidity uses an\\n     * invalid opcode to revert (consuming all remaining gas).\\n     *\\n     * Requirements:\\n     * - The divisor cannot be zero.\\n     */\\n    function mod(uint256 a, uint256 b) internal pure returns (uint256) {\\n        return mod(a, b, \\\"SafeMath: modulo by zero\\\");\\n    }\\n\\n    /**\\n     * @dev Returns the remainder of dividing two unsigned integers. (unsigned integer modulo),\\n     * Reverts with custom message when dividing by zero.\\n     *\\n     * Counterpart to Solidity's `%` operator. This function uses a `revert`\\n     * opcode (which leaves remaining gas untouched) while Solidity uses an\\n     * invalid opcode to revert (consuming all remaining gas).\\n     *\\n     * Requirements:\\n     * - The divisor cannot be zero.\\n     */\\n    function mod(uint256 a, uint256 b, string memory errorMessage) internal pure returns (uint256) {\\n        require(b != 0, errorMessage);\\n        return a % b;\\n    }\\n}\",\"keccak256\":\"0x756ee11c114f3e80b76743614fc24c82fc74b44691d7410129a9a858f8e30679\"}},\"version\":1}",
  "bytecode": "0x608060405234801561001057600080fd5b5060405162000af738038062000af78339818101604052608081101561003557600080fd5b50805160208201516040830151606090930151600080546001600160a01b031916321790559192909183838383610077848484846001600160e01b0361008416565b50505050505050506102b4565b61009e622014808561016760201b6106581790919060201c565b6002556100ed6100bc62201480836101b8602090811b6105ff17901c565b6100db670de0b6b3a7640000866101b860201b6105ff1790919060201c565b61016760201b6106581790919060201c565b6001556101088262201480610167602090811b61065817901c565b60038190556004829055600254600154604080519283526020830191909152818101929092526060810183905290517f6960ab234c7ef4b0c9197100f5393cfcde7c453ac910a27bd2000aa1dd4c068d9181900360800190a150505050565b60006101af83836040518060400160405280601a81526020017f536166654d6174683a206469766973696f6e206279207a65726f00000000000081525061021260201b60201c565b90505b92915050565b6000826101c7575060006101b2565b828202828482816101d457fe5b04146101af5760405162461bcd60e51b815260040180806020018281038252602181526020018062000ad66021913960400191505060405180910390fd5b6000818361029e5760405162461bcd60e51b81526004018080602001828103825283818151815260200191508051906020019080838360005b8381101561026357818101518382015260200161024b565b50505050905090810190601f1680156102905780820380516001836020036101000a031916815260200191505b509250505060405180910390fd5b5060008385816102aa57fe5b0495945050505050565b61081280620002c46000396000f3fe608060405234801561001057600080fd5b50600436106100b45760003560e01c80638da5cb5b116100715780638da5cb5b14610198578063a385fb96146101bc578063b8168816146101c4578063b9f9850a146101f3578063f14039de146101fb578063fd2da33914610203576100b4565b806315f24053146100b95780632037f3e7146100f45780632191f92a146101255780636e71e2d814610141578063704b6c021461016a5780638726bb8914610190575b600080fd5b6100e2600480360360608110156100cf57600080fd5b508035906020810135906040013561020b565b60408051918252519081900360200190f35b6101236004803603608081101561010a57600080fd5b5080359060208101359060408101359060600135610222565b005b61012d61027d565b604080519115158252519081900360200190f35b6100e26004803603606081101561015757600080fd5b5080359060208101359060400135610282565b6101236004803603602081101561018057600080fd5b50356001600160a01b03166102d8565b6100e2610343565b6101a0610349565b604080516001600160a01b039092168252519081900360200190f35b6100e2610358565b6100e2600480360360808110156101da57600080fd5b508035906020810135906040810135906060013561035f565b6100e26103de565b6100e26103e4565b6100e26103ea565b60006102188484846103f0565b90505b9392505050565b6000546001600160a01b0316331461026b5760405162461bcd60e51b81526004018080602001828103825260268152602001806107b86026913960400191505060405180910390fd5b610277848484846104b9565b50505050565b600181565b6000826102915750600061021b565b6102186102b4836102a8878763ffffffff61055a16565b9063ffffffff6105bd16565b6102cc85670de0b6b3a764000063ffffffff6105ff16565b9063ffffffff61065816565b6000546001600160a01b031633146103215760405162461bcd60e51b81526004018080602001828103825260268152602001806107b86026913960400191505060405180910390fd5b600080546001600160a01b0319166001600160a01b0392909216919091179055565b60015481565b6000546001600160a01b031681565b6220148081565b60008061037a670de0b6b3a76400008463ffffffff6105bd16565b905060006103898787876103f0565b905060006103a9670de0b6b3a76400006102cc848663ffffffff6105ff16565b90506103d2670de0b6b3a76400006102cc836103c68c8c8c610282565b9063ffffffff6105ff16565b98975050505050505050565b60035481565b60025481565b60045481565b6000806103fe858585610282565b905060045481116104445761043c600254610430670de0b6b3a76400006102cc600154866105ff90919063ffffffff16565b9063ffffffff61055a16565b91505061021b565b600061046f600254610430670de0b6b3a76400006102cc6001546004546105ff90919063ffffffff16565b90506000610488600454846105bd90919063ffffffff16565b90506104af82610430670de0b6b3a76400006102cc600354866105ff90919063ffffffff16565b935050505061021b565b6104cc846220148063ffffffff61065816565b6002556104e56102b4622014808363ffffffff6105ff16565b6001556104fb826220148063ffffffff61065816565b60038190556004829055600254600154604080519283526020830191909152818101929092526060810183905290517f6960ab234c7ef4b0c9197100f5393cfcde7c453ac910a27bd2000aa1dd4c068d9181900360800190a150505050565b6000828201838110156105b4576040805162461bcd60e51b815260206004820152601b60248201527f536166654d6174683a206164646974696f6e206f766572666c6f770000000000604482015290519081900360640190fd5b90505b92915050565b60006105b483836040518060400160405280601f81526020017f536166654d6174683a207375627472616374696f6e20756e646572666c6f770081525061069a565b60008261060e575060006105b7565b8282028284828161061b57fe5b04146105b45760405162461bcd60e51b81526004018080602001828103825260218152602001806107976021913960400191505060405180910390fd5b60006105b483836040518060400160405280601a81526020017f536166654d6174683a206469766973696f6e206279207a65726f000000000000815250610731565b600081848411156107295760405162461bcd60e51b81526004018080602001828103825283818151815260200191508051906020019080838360005b838110156106ee5781810151838201526020016106d6565b50505050905090810190601f16801561071b5780820380516001836020036101000a031916815260200191505b509250505060405180910390fd5b505050900390565b600081836107805760405162461bcd60e51b81526020600482018181528351602484015283519092839260449091019190850190808383600083156106ee5781810151838201526020016106d6565b50600083858161078c57fe5b049594505050505056fe536166654d6174683a206d756c7469706c69636174696f6e206f766572666c6f776f6e6c7920746865206f776e6572206d61792063616c6c20746869732066756e6374696f6e2ea265627a7a72315820f1616259914088557de50fe778d0a6c6e63a39dcae0c7f97bd1c2345942511c764736f6c63430005100032536166654d6174683a206d756c7469706c69636174696f6e206f766572666c6f77",
  "deployedBytecode": "0x608060405234801561001057600080fd5b50600436106100b45760003560e01c80638da5cb5b116100715780638da5cb5b14610198578063a385fb96146101bc578063b8168816146101c4578063b9f9850a146101f3578063f14039de146101fb578063fd2da33914610203576100b4565b806315f24053146100b95780632037f3e7146100f45780632191f92a146101255780636e71e2d814610141578063704b6c021461016a5780638726bb8914610190575b600080fd5b6100e2600480360360608110156100cf57600080fd5b508035906020810135906040013561020b565b60408051918252519081900360200190f35b6101236004803603608081101561010a57600080fd5b5080359060208101359060408101359060600135610222565b005b61012d61027d565b604080519115158252519081900360200190f35b6100e26004803603606081101561015757600080fd5b5080359060208101359060400135610282565b6101236004803603602081101561018057600080fd5b50356001600160a01b03166102d8565b6100e2610343565b6101a0610349565b604080516001600160a01b039092168252519081900360200190f35b6100e2610358565b6100e2600480360360808110156101da57600080fd5b508035906020810135906040810135906060013561035f565b6100e26103de565b6100e26103e4565b6100e26103ea565b60006102188484846103f0565b90505b9392505050565b6000546001600160a01b0316331461026b5760405162461bcd60e51b81526004018080602001828103825260268152602001806107b86026913960400191505060405180910390fd5b610277848484846104b9565b50505050565b600181565b6000826102915750600061021b565b6102186102b4836102a8878763ffffffff61055a16565b9063ffffffff6105bd16565b6102cc85670de0b6b3a764000063ffffffff6105ff16565b9063ffffffff61065816565b6000546001600160a01b031633146103215760405162461bcd60e51b81526004018080602001828103825260268152602001806107b86026913960400191505060405180910390fd5b600080546001600160a01b0319166001600160a01b0392909216919091179055565b60015481565b6000546001600160a01b031681565b6220148081565b60008061037a670de0b6b3a76400008463ffffffff6105bd16565b905060006103898787876103f0565b905060006103a9670de0b6b3a76400006102cc848663ffffffff6105ff16565b90506103d2670de0b6b3a76400006102cc836103c68c8c8c610282565b9063ffffffff6105ff16565b98975050505050505050565b60035481565b60025481565b60045481565b6000806103fe858585610282565b905060045481116104445761043c600254610430670de0b6b3a76400006102cc600154866105ff90919063ffffffff16565b9063ffffffff61055a16565b91505061021b565b600061046f600254610430670de0b6b3a76400006102cc6001546004546105ff90919063ffffffff16565b90506000610488600454846105bd90919063ffffffff16565b90506104af82610430670de0b6b3a76400006102cc600354866105ff90919063ffffffff16565b935050505061021b565b6104cc846220148063ffffffff61065816565b6002556104e56102b4622014808363ffffffff6105ff16565b6001556104fb826220148063ffffffff61065816565b60038190556004829055600254600154604080519283526020830191909152818101929092526060810183905290517f6960ab234c7ef4b0c9197100f5393cfcde7c453ac910a27bd2000aa1dd4c068d9181900360800190a150505050565b6000828201838110156105b4576040805162461bcd60e51b815260206004820152601b60248201527f536166654d6174683a206164646974696f6e206f766572666c6f770000000000604482015290519081900360640190fd5b90505b92915050565b60006105b483836040518060400160405280601f81526020017f536166654d6174683a207375627472616374696f6e20756e646572666c6f770081525061069a565b60008261060e575060006105b7565b8282028284828161061b57fe5b04146105b45760405162461bcd60e51b81526004018080602001828103825260218152602001806107976021913960400191505060405180910390fd5b60006105b483836040518060400160405280601a81526020017f536166654d6174683a206469766973696f6e206279207a65726f000000000000815250610731565b600081848411156107295760405162461bcd60e51b81526004018080602001828103825283818151815260200191508051906020019080838360005b838110156106ee5781810151838201526020016106d6565b50505050905090810190601f16801561071b5780820380516001836020036101000a031916815260200191505b509250505060405180910390fd5b505050900390565b600081836107805760405162461bcd60e51b81526020600482018181528351602484015283519092839260449091019190850190808383600083156106ee5781810151838201526020016106d6565b50600083858161078c57fe5b049594505050505056fe536166654d6174683a206d756c7469706c69636174696f6e206f766572666c6f776f6e6c7920746865206f776e6572206d61792063616c6c20746869732066756e6374696f6e2ea265627a7a72315820f1616259914088557de50fe778d0a6c6e63a39dcae0c7f97bd1c2345942511c764736f6c63430005100032",
  "devdoc": {
    "author": "Arr00",
    "methods": {
      "getBorrowRate(uint256,uint256,uint256)": {
        "params": {
          "borrows": "The amount of borrows in the market",
          "cash": "The amount of cash in the market",
          "reserves": "The amount of reserves in the market"
        },
        "return": "The borrow rate percentage per block as a mantissa (scaled by 1e18)"
      },
      "getSupplyRate(uint256,uint256,uint256,uint256)": {
        "params": {
          "borrows": "The amount of borrows in the market",
          "cash": "The amount of cash in the market",
          "reserveFactorMantissa": "The current reserve factor for the market",
          "reserves": "The amount of reserves in the market"
        },
        "return": "The supply rate percentage per block as a mantissa (scaled by 1e18)"
      },
      "setAdmin(address)": {
        "params": {
          "_newOwner": "The new owner address"
        }
      },
      "updateJumpRateModel(uint256,uint256,uint256,uint256)": {
        "params": {
          "baseRatePerYear": "The approximate target base APR, as a mantissa (scaled by 1e18)",
          "jumpMultiplierPerYear": "The multiplierPerBlock after hitting a specified utilization point",
          "kink_": "The utilization point at which the jump multiplier is applied",
          "multiplierPerYear": "The rate of increase in interest rate wrt utilization (scaled by 1e18)"
        }
      },
      "utilizationRate(uint256,uint256,uint256)": {
        "params": {
          "borrows": "The amount of borrows in the market",
          "cash": "The amount of cash in the market",
          "reserves": "The amount of reserves in the market (currently unused)"
        },
        "return": "The utilization rate as a mantissa between [0, 1e18]"
      }
    },
    "title": "Compound's JumpRateModel Contract V2 for V2 cTokens"
  },
  "userdoc": {
    "methods": {
      "getBorrowRate(uint256,uint256,uint256)": {
        "notice": "Calculates the current borrow rate per block"
      },
      "getSupplyRate(uint256,uint256,uint256,uint256)": {
        "notice": "Calculates the current supply rate per block"
      },
      "setAdmin(address)": {
        "notice": "external function to transfer owner role"
      },
      "updateJumpRateModel(uint256,uint256,uint256,uint256)": {
        "notice": "Update the parameters of the interest rate model (only callable by owner, i.e. Timelock)"
      },
      "utilizationRate(uint256,uint256,uint256)": {
        "notice": "Calculates the utilization rate of the market: `borrows / (cash + borrows - reserves)`"
      }
    },
    "notice": "Supports only for V2 cTokens"
  },
  "storageLayout": {
    "storage": [
      {
        "astId": 48,
        "contract": "contracts/InterestRateModels/JumpRateModelV2.sol:JumpRateModelV2",
        "label": "owner",
        "offset": 0,
        "slot": "0",
        "type": "t_address"
      },
      {
        "astId": 53,
        "contract": "contracts/InterestRateModels/JumpRateModelV2.sol:JumpRateModelV2",
        "label": "multiplierPerBlock",
        "offset": 0,
        "slot": "1",
        "type": "t_uint256"
      },
      {
        "astId": 55,
        "contract": "contracts/InterestRateModels/JumpRateModelV2.sol:JumpRateModelV2",
        "label": "baseRatePerBlock",
        "offset": 0,
        "slot": "2",
        "type": "t_uint256"
      },
      {
        "astId": 57,
        "contract": "contracts/InterestRateModels/JumpRateModelV2.sol:JumpRateModelV2",
        "label": "jumpMultiplierPerBlock",
        "offset": 0,
        "slot": "3",
        "type": "t_uint256"
      },
      {
        "astId": 59,
        "contract": "contracts/InterestRateModels/JumpRateModelV2.sol:JumpRateModelV2",
        "label": "kink",
        "offset": 0,
        "slot": "4",
        "type": "t_uint256"
      }
    ],
    "types": {
      "t_address": {
        "encoding": "inplace",
        "label": "address",
        "numberOfBytes": "20"
      },
      "t_uint256": {
        "encoding": "inplace",
        "label": "uint256",
        "numberOfBytes": "32"
      }
    }
  }
}